Great Plains Regional Technical Input Report (NCA Regional Input Reports)," Jul 21, 2015",by,Dennis Ojima and ,Dr. Jean Steiner,,Paperback,,$,39,99,,,,FREE Shipping on eligible orders,Only 1 left in stock - order soon.,More Buying Choices,,$35.15 used & new,(10 offers),,,Kindle Edition,$,31,49,,,,,,,"Books: See all 2,276 items"
"Diman Regional Vocational Technical High School Fall River, Massachusetts Original Vintage Postcard",,by,CardCow Vintage Postcards,,,,,$,18,99, + $3.50 shipping,,,,Only 1 left in stock - order soon.,,,,,,,,,,,,,,,,,Collectibles & Fine Art: See all 4 items
"Norwich Regional Technical School Norwich, Connecticut Original Vintage Postcard",,by,CardCow Vintage Postcards,,,,,$,18,99, + $3.50 shipping,,,,Only 1 left in stock - order soon.,,,,,,,,,,,,,,,,,Collectibles & Fine Art: See all 4 items
"Norwich Regional Technical School Norwich, Connecticut Original Vintage Postcard",,by,CardCow Vintage Postcards,,,,,$,11,99, + $3.50 shipping,,,,Only 1 left in stock - order soon.,,,,,,,,,,,,,,,,,Collectibles & Fine Art: See all 4 items
"Revolutionary Acts: Amateur Theater and the Soviet State, 1917-1938",,by,,,Lynn Mally,Kindle Edition,,$,0,0,,,,FREE Shipping on eligible orders,,More Buying Choices,,$17.94 used & new,(9 offers),,,Paperback,$,19,95,Other Formats:,Hardcover,1,,,,Kindle Store: See all 100 items
"Norwich Regional Technical School Norwich, Connecticut Original Vintage Postcard",,by,CardCow Vintage Postcards,,,,,$,8,99, + $3.50 shipping,,,,Only 1 left in stock - order soon.,,,,,,,,,,,,,,,,,Collectibles & Fine Art: See all 4 items
"Useful trees and shrubs for Ethiopia: Identification, propagation, and management for agricultural and pastoral communities…",1993,by,,,Azene Bekele-Tesemma,Paperback,,,,,,,,,,,,$31.89 used & new,(2 offers),,,,,,,,,,,,,"Books: See all 2,276 items"
Guardian - Weekly Edition, Newspaper Subscription | 51 issues / 12 months,by,Guardian,,,,,,,,,,,Currently unavailable,,,,,,,,,,,,,,19,,,,Magazine Subscriptions: See all items
Farmer's Almanac,,by,WalterDrake,,,,,$,10,14,,$11.95 ,,FREE Shipping on eligible orders,,,,,,,,,,,,,,,,Product Features,Includesd everything from regional weather forecasts to natural remedies,Everything Else: See all items
ARRIS SURFboard SBG6580 DOCSIS 3.0 Cable Modem/ Wi-Fi N300/N300 Dual Band Router - Retail Packaging Black (570763…,,by,Arris,,,,,$,99,99,,,,FREE Shipping on eligible orders,,"In stock on February 12, 2017",More Buying Choices,$90.71 new,(44 offers),$22.25 used,(91 offers),,,,,,,"5,531",Trade-in eligible for an Amazon gift card,Product Features,... Warranty with US Technical Support. ... almost all Regional Cable …,Electronics: See all 7 items
NLS SOCCERS INC," Jul 16, 2014",by,ONS Interactive Solutions Pvt. Ltd.,,,,Free ,,,,,,,Available instantly on compatible devices,,,,,,,,,,,,,,,,Product Features,"... consistent, technical training by ... Broward Regional Park …",Apps & Games: See all 2 items
"Strategic Writing: Multimedia Writing for Public Relations, Advertising, and More"," Jul 20, 2011",by,David W. Guth,, Charles Marsh,Paperback,,$,96,23,,$116.95 ,"Get it by Friday, Feb 10",FREE Shipping on eligible orders,,More Buying Choices,,$54.09 used & new,(71 offers),,,Kindle Edition,$,82,51,,,13,Trade in yours for an Amazon Gift Card up to $28.25,,,Office Products: See all items
Skills Development in Sub-Saharan Africa (Regional and Sectoral Studies)," Mar 1, 2004",by,Arvil V. Adams and,,Richard K. Johanson,Paperback,,$,25,0,,,,FREE Shipping on eligible orders,Only 1 left in stock - order soon.,More Buying Choices,,$5.37 used & new,(19 offers),,,,,,,,,,,,,"Books: See all 2,276 items"
My Home Ain't Here: The New Orleans Session," Aug 31, 2004",by,,,Homesick James,Audio CD,,$,13,99,,,,FREE Shipping on eligible orders,Only 1 left in stock - order soon.,More Buying Choices,,$5.93 used & new,(23 offers),,,,,,,,,1,,Product Description,"... slide guitar blues. In times of technical perfection, a raw and honest …",CDs & Vinyl: See all items
WRC - FIA World Rally Championship (PS3) (UK),,by,BLACK BEAN,,,PlayStation 3,,$,49,88,,,,FREE Shipping on eligible orders,Only 4 left in stock - order soon.,More Buying Choices,,$29.90 used & new,(32 offers),,,,,,,,,5,,Product Features,... in regional championship ... through the technical asphalt trails …,Video Games: See all items
LANDVO JJRC H8D FPV Headless Mode 6-Axis 2.4Ghz Gyro RTF RC Quadcopter Helicopter Drone with 5.8G 2MP HD Camera…,,by,LANDVO,,,,,,,,,,,,,,,$139.00 new,(1 offer),$149.00 used,(1 offer),,,,,,,205,,Product Features,... player's technical level model. ... multi-regional multi-range …,Toys & Games:See all 6 items
