$247.98 , , , , , , Franklin Quikset Rebound Pro Arcade Basketball, , Available online only, , , Compare
$249.99 , , , , , , Wilson X Connected Smart Basketball - Size 7, , Available online, , Available at nearby stores, Compare
$69.99 , , , , , , Franklin Sports Shoot Again Arcade Basketball Set,-2, Available online only, , , Compare
$34.98 , , , , , , Sportcraft Electronic Indoor Basketball Set (SC10046), , Available online only, , , Compare
$139.99 , , , , , , HOMCOM Jersey Frame Display Case Shirt Shadow Box Cabinet Football Baseball Basketball Black, , Available online only, Sold and shipped by Aosom Canada, , Compare
$529.99 , , , , , , Spalding NBA Portable Basketball System - Black/Blue, , Available online only, , , Compare
$87.98 , , , , , , Spalding TF-1000 Legacy Basketball, , Available online only, , , Compare
$32.99 , , , , , , Spalding NBA All Conference Basketball, , Available online only, , , Compare
$94.99 , , , , , , Soozier 61.8''-73.6H Adjustable Junior Youth Basketball Hoop System Set with Basketball and Pump, , Available online only, Sold and shipped by Aosom Canada, , Compare
$249.99 , , , , , , Wilson X Connected Smart Basketball - Size 6, , Available online, , Sold out in nearby stores, Compare
$17.09 , , , , , ," Insten Tuff Basketball Hard Dual Layer Silicone Case For Apple iPhone 4/4S, Brown/Black", , Available online only, Sold and shipped by eForCity, , Compare
$264.99 , , , , , , Spalding NBA Portable Basketball Board & Hoop - Black/Blue, , Available online only, , , Compare
$59.99 , , , , , , Spalding Never Flat Premium Basketball, , Available online only, , , Compare
$24.99 , , , , , , Spalding NBA Street Pro Soft Grip Basketball, , Available online only, , , Compare
$34.99 , , , , , , Spalding Never Flat Basketball, , Available online only, , , Compare
$29.99 , , , , , , Spalding Rookie Gear Basketball, , Available online only, , , Compare
$19.99 , , , , , , Spalding NBA Green Basketball, , Available online only, , , Compare
$44.00 , , , , , ," Verbatim 16GB Mini USB Flash Drive, Sports Edition - Basketball", , Available online only, Sold and shipped by Mike's Computer Shop, , Compare
$234.99 , , , , , , Soozier 6.5'-10' Adjustable Portable Youth Kids Basketball Hoop System Stand Outdoor, , Available online only, Sold and shipped by Aosom Canada, , Compare
$127.99 , , , , , , Soozier Portable Basketball Stand System Junior Adjustable W/ Wheels, , Available online only, Sold and shipped by Aosom Canada, , Compare
$37.99 , , , , , , Hathaway Mini Basketball, , Available online only, , , Compare
$19.99 , , , , , , Spalding NBA Varsity Basketball, , Available online only, , , Compare
$7.99 , , , , , , Basketball Girlfriend, , Available online only, , , Compare
$29.99 , , , , , , GDC Decision Day: Fantasy Basketball Board Game (20011), , Available online only, , , Compare
 ,$149.99 , Save,$45 , Sale ends:," March 1, 2017", Beats by Dr. Dre Powerbeats 2 In-Ear Bluetooth Headphones - Black,-5625, Available online, , Available at nearby stores, Compare
$79.99 , , , , , , NBA 2K18 (Switch), , Available for Pre-Order, , , Compare
$139.99 , , , , , , Beats by Dr. Dre Powerbeats 2 In-Ear Bluetooth Headphones - Black - Open Box,-5, Sold out online, , , Compare
$14.99 , , , , , , Space Jam (20th Anniversary Edition) (SteelBook) (Blu-ray Combo),-2, Sold out online, , Available at nearby stores, Compare
$298.98 , , , , , , Hathaway Accelerator 54 4-in-1 Electronic Multi-Game Table (BG1016M), , Available online only, , , Compare
$88.90 , , , , , , Iron Jack Fitness Poly Dacron Battle Rope With Anchor Straps for Core Strength Training Agility and Speed, , Available online only, Sold and shipped by Top Shop Sales, , Compare
$49.99 , , , , , , VTech Smart Shots Sports Center - English,-1, Available online only, , , Compare
$49.99 , , , , , , VTech Smart Shots Sports Center - French, , Available online only, , , Compare
