Revisiting Leisure Suit Larry,,,2 years 1 month ago,"...played a Leisure Suit Larry game before, what sort of expectations would you have going in? As long as you’re vaguely aware of the series’ decades-long reputation... ",,,,,,
Leisure Goods ,,Final Fantasy XV Wiki,1 month 26 days ago,Leisure goods are a type of item in Final Fantasy XV that allow you to interact with the world around you outside of missions. These items can be baits... ,,,,,,
Leisure Suit Larry: Magna Cum Laude ,,"by Sierra for Xbox , PC , PS2 , Cell",13-Oct-04,"Leisure Suit Larry: Magna Cum Laude is the coming of age story about Larry Lovage, nephew of Larry Laffer, the series' original lovable loser. In Magna... ",> Videos, > Cheats ,> Articles, > Images ,> Review, > Wiki 
Silicon Garaje Arts,,,,"Garaje Arts (or Silicon Garage Arts) is a company dedicated to create interactive leisure services, produce videogames and virtual recreations. Based in... ",,,,,,
Deadly Arts,,by Konami for N64,22-Sep-98,"DEADLY ARTS. In this beautifully rendered collection of backgrounds, you can face off against challenging opponents with your own virtual character, using... ",> Videos, > Cheats ,> Articles,> Images,> Review,
Liberal Arts,,by IFC Films ,14-Sep-12,,,,,,,
Leisure Suit Larry Reloaded ,,"by Replay Studios for PC , Linux , Mac , iPhone , Android",27-Jun-13,"...star of Leisure Suit Larry -- is back in his original incarnation. Larry's original creator, Al Lowe, and the team from Replay Games have brought the original... ",> Videos,> Cheats,> Articles,> Images,> Review,> Wiki
Leisure Genius Presents: Monopoly ,,"by Mastertronic for  C64 , PC , Amiga , ZX",24-Jan-88,,> Videos,> Cheats,> Articles,> Images,,
Leisure Suit Larry Reloaded Review,,IGN Review ,3 years 6 months ago,It’s not Leisure Suit Larry Reloaded’s shamelessly sexually explicit jokes and double entendres that’ve grown stale since the original Sierra point-and-click…,,,,,,
Combat Arts,0:53,,8 years 6 months ago,,,,,,,
