WWE 2K16 Pre-Order Exclusive: Get Arnold Schwarzenegger ,, ... World Heavyweight Champion Triple H and WWE Hall of Famer Arnold Schwarzenegger answer questions at the 2016 Arnold Sports Festival in ... 
,Clothes make the man ," ... Marcellus Wiley on ESPN's ""SportsNation,"" The Miz expresses his love and loyalty to his hometown Cleveland sports teams. ... Clothes make the man. ... "
Where Are They Now? Pat Rose ,," ... ""Then I realized that Orndorff put his clothes on the same way I did. ... This is an expert sport — just like sports-entertainment. ... "
Now...it's personal ,," ... through to somebody's skin to their bones, or just through the clothes to the ... What would you be doing if you weren't working in sports-entertainment ... "
WWE fan diary ,," ... and, thankfully, decades of clothing and hairstyle ... if Shawn Michaels was still sporting the neon ... fans involvement in sports-entertainment's biggest ... "
WWE Network: Eric Bischoff's controversial ride to the top ,, ... the scenes of Eric Bischoff's rise to becoming sports-entertainment's most ... The Dudley Boyz talk about their trademark camo clothing and their ... 
Cena dishes up some 'Cold Pizza' ,," ... but the WWE Champion was honored with the sports morning show's ... The Champ was dressed in street clothes, with the WWE Championship slung ... "
Diva Dish: Online entrepreneur ,," ... and loyalty to his hometown Cleveland sports teams ... awaiting the opening of my online clothing store ... bit up right now, but the clothes and everything ... "
Kmart WWE Gift Guide ,," ... expresses his love and loyalty to his hometown Cleveland sports teams. ... Find the best WWE toys, clothing, home fashions, sporting goods at ... "
"Kmart WWE Gift Guide, Part 2 ",," ... holiday season. Find the best WWE toys, clothing, home fashions, sporting goods at your local Kmart and kmart.com! Check ... "
