Science Flashcard Journal and Integrated Lesson - 3,,Create cover page for journal. ... Science Flashcard Journal and Integrated Lesson. by cpodgorn in books-and-journals. Download. 5 Steps. Share. Facebook ..., http://www.instructables.com/id/Science-Flashcard-Journal-and-Integrated-Lesson/step3/step...
Science Flashcard Journal and Integrated Lesson,,"Dec 10, 2012 ... Analyze what happens to a solid when heat is applied to it and record observations in the science journal they have created. · Draw a ...", http://www.instructables.com/id/Science-Flashcard-Journal-and-Integrated-Lesson/
,Real Time Display of Sensor Data on App SJ With Link Node - 3,"... sensor provide by the BLE sensors tag combined with Journal App Science, to take ... Science Journal App, BLE sensors tag has also downloaded the firmware.", http://www.instructables.com/id/Real-Time-Display-of-Sensor-Data-on-App-SJ-With-Li/step3/J...
How To Keep A Scientific Journal - All,,"Science is very interesting. Simply put, it is the study of ""stuff"", through observation and exploration. Putting long hours into such activities is highly impractical, ...", https://www.instructables.com/id/How-To-Keep-A-Scientific-Journal/?ALLSTEPS
,IDEAS: The Innovation + Design Series - Participants A-L,"His media career began at the two premier science journals, Nature and Science, where he served in several editorial capacities. He holds a bachelor of ...", http://usa.autodesk.com/adsk/servlet/pc/index?siteID=123112&id=15373799
Making A Cloud Journal,,Making A Cloud Journal. by JackDC2000 in science. Download. 11 Steps ... VISUAL REFERENCE-A picture to accompany your journal. TEMPERATURE- The ..., http://www.instructables.com/id/Making-A-Cloud-Journal/
journal 3D models | Autodesk 123D,,Free 3d models and projects matching journal. Royalty free ... Science Enginneering Design Journal 1 3d model made with 123D Design · Cullen Moore ..., http://www.123dapp.com/Search/journal/content/all
,Moldflow publications-from Moldflow-funded research | Moldflow ...,"Jan 2, 2017 ... PVT Measurement Methodology for Semicrystalline Polymers to Simulate Injection-Molding Process, Journal of Applied Polymer Science 79, ...", https://knowledge.autodesk.com/support/moldflow-insight/learn-explore/caas/CloudHelp/cloud...
,Moldflow publications-from Moldflow-funded research | Search ...,"Apr 1, 2015 ... Journal of Applied Polymer Science, 79, Issue 2:302-311. Dalgarno, K. W., and Stewart, T. D. 2001. Manufacture of production injection mould ...", http://knowledge.autodesk.com/search-result/caas/CloudHelp/cloudhelp/2016/ENU/MoldflowComm...
Making A Cloud Journal - 5,,"This is under the science sub section of the technology category. Honestly, I don't know why they don't have a science category all to itself. 2 years ago.", http://www.instructables.com/id/Making-A-Cloud-Journal/step5/Day-Four/
