"Australia's domestic economy might be humming, but small business conditions are tough",Business Insider Australia,,,"Mar. 9, 2016, 6:00 PM",,74,... level of 100. What's clear in the responses to the survey is that overall business activity and sales are on the stronger side of the ledger but that business …
German business optimism up on strong domestic economy,"David Mchugh, Associated Press",,,"Nov. 17, 2015, 6:06 AM",,69,"FRANKFURT, Germany (AP) — A key measure of German economic optimism rose more than expected thanks to strong domestic demand from consumers — and showed little impact from the terror …"
Survivors of Domestic Violence Get a Shot at Entrepreneurship,Small Business Trends ,,,"May 30, 2011, 6:00 AM",,84,"... small business, serve as collateral for a business loan or pay for business education courses. Interested applicants should submit a business proposal, along with a letter from a domestic …"
Survivors of Domestic Violence Get a Shot at Entrepreneurship,Small Business Trends,,,"May 30, 2011, 6:00 AM",,6,"... small business, serve as collateral for a business loan or pay for business education courses. Interested applicants should submit a business proposal, along with a letter from a domestic …"
"Obama Benefits From Good Luck Internationally, But Domestically It’s a Different Story",Small Business Trends,,,"Nov. 1, 2011, 2:30 PM",,0,"... harness it and help small businesses, which generate a majority of the new jobs in the economy. From Small Business TrendsObama Benefits From Good Luck Internationally, But Domestic …"
CHART: Australian Domestic Tourism Is Back Near Its Pre-GFC Peak,Business Insider Australia,,,"Jun. 13, 2013, 8:52 PM",,13,More hols at home as dollar slides. More »Read more posts on Business Insider Australia
The Socceroos Will Be Hanging Out In The Sydney Domestic Qantas Club Later This Morning,Business Insider Australia,,,"Jun. 12, 2013, 6:46 PM",,2,In the lead up to the critical Iraq match. More »Read more posts on Business Insider Australia
Soon there could be a Trump hotel in every major US city,Bob Bryan,,,"Jan. 25, 2017, 11:20 AM","6,831",,"... other international markets were no longer happening and that the company's expansion would have a ""domestic emphasis for the next four or eight years."" Trump turned over his business …"
McDonald’s could finally catch up to Burger King and Wendy’s with its newest test,Kate Taylor,,,"Jan. 24, 2017, 11:14 AM","6,962",,"... Big Mac, and with this menu item apparently requiring no additional [ingredients] for the restaurants, if it sells well perhaps McDonald's U.S. might consider it for the domestic …"
Trump's plan for taxes may have some unintended consequences,"Andrew Norelli, J.P. Morgan Asset Management",,,"Jan. 15, 2017, 3:03 PM",,,"... paid by the final consumer is remitted to the government. If this were the whole story, countries with VAT would disadvantage their domestic producers versus foreign producers, because domestic …"
How to get an American Airlines business class seat for the price of economy,"Cailey Rizzo, Travel + Leisure ",,,"Oct. 17, 2016, 10:57 AM","1,651",,"... on domestic routes. These international planes are usually set up with three different classes (first, business and economy) while the domestic planes are set up with only two (business …"
TOP OIL TRADER: Trump’s border tax would make filling your car up with gas more expensive,Rachael Levy,,,"Jan. 26, 2017, 11:13 AM","9,903",,"... , a $1.6 billion hedge fund firm. ""Such a tax would also increase domestic gasoline prices in the US."" A copy of the January 16 note was reviewed by Business …"
What you need to know on Wall Street right now,Portia Crowe,,,9h,622,,"Welcome to Finance Insider, Business Insider's summary of the top stories of the past 24 hours. US gross domestic product, or GDP, whiffed in the fourth quarter, increasing at an …"
Iran just got its first new Airbus in decades,Al Jazeera,,,"Jan. 12, 2017, 10:18 AM ",574,,"... of negotiating an order for 20 turboprops from Toulouse-based ATR, which is jointly owned by Airbus and Italy's Leonardo Finmeccanica. The A321 will primarily be used for domestic …"
Toshiba is going unload part of its chip business,Reuters,,,14h,843,,... account for huge cost overruns at a U.S. power plant construction business recently acquired by its Westinghouse division. Describing the nuclear division as no longer a central business …
"Ivanka Trump, Jared Kushner take steps to sever business ties as Kushner takes top White House job",Allan Smith,,,"Jan. 9, 2017, 5:58 PM","15,318",,"Jared Kushner and Ivanka Trump are expected to divest from ""substantial assets"" in their businesses as the former accepts a job in President-elect Donald Trump's White House administration, …"
Indian shoppers turn to overseas e-commerce,BI Intelligence,,," Jan. 17, 2017, 11:11 AM","1,367",,"This story was delivered to BI Intelligence ""E-Commerce Briefing"" subscribers. To learn more and subscribe, please click here. Despite the growing success of domestic e-commerce platforms, a new …"
Amazon is launching its own athleisure brand,Avery Hartmans,,,"Jan. 4, 2017, 10:15 AM ","9,241",,"... is expected to jump from 5% of the total in 2014 to 14% by 2020, making it the largest domestic apparel retailer, replacing the current leader, Macy’s. Business …"
Morgan Stanley analyst says don't invest in Tesla because of Trump,Matthew DeBord ,,,14h,"3,831",,"After criticizing now-President Donald Trump during the election, Tesla and SpaceX CEO Elon Musk has dome something of a 180-degree turnabout. He's joined Trump's council of business advisors and …"
13 incredible facts about Texas,Akin Oyedele,and,Elena Holodny,"Aug. 27, 2016, 3:30 PM",,,"... Lone Star State were its own country, it would have the 10th-highest gross domestic product in the world. Some of that growth is attributed to Texas' energy business …"
