CDC - Environmental Health,,, www.cdc.gov/environmental/index.html,"CDC's National Center for Environmental Health (NCEH) plans, directs, and coordinates a national program to maintain and improve the health of the ... "
CDC - EHS - EHTER - Environmental Health Training in …,,, www.cdc.gov/nceh/ehs/elearn/ehter.htm,"CDC’s Environmental Health Services Branch provides resources on preventing foodborne illnesses and outbreaks, protecting water, and improving …"
CDC | National Center for Environmental Health,,, www.cdc.gov/nceh/,"CDC's National Center for Environmental Health (NCEH) plans, directs, and coordinates a national program to maintain and improve the health of the …"
CDC | National Center for Environmental Health | Data …,,, www.cdc.gov/nceh/data.htm,One-Stop Shop for Environmental Public Health Data. This Web site provides a reference list of nationally funded data systems that have a relationship …
CDC - National Center for Environmental Health - Emergency …,,, www.cdc.gov/nceh/eehs/,Learn how CDC’s National Center for Environmental Health/Division of Emergency and Environmental Health Services (EEHS) advances environmental public ... 
CDC | National Center for Environmental Health …,,, www.cdc.gov/nceh/publications.htm,Data Resources for the National Center for Environmental Health
EHS-Net Home | EHS | CDC,,, www.cdc.gov/nceh/ehs/EHSNet/index.htm,EHS-Net (pronounced S-Net) is a collaborative forum of environmental health specialists whose mission is to improve environmental health practice. 
EHS Pictorial Keys | EHS | CDC,,, www.cdc.gov/nceh/ehs/Publications/Pictorial_Keys.htm,"The Environmental Health Services Branch provides the practice-based research, training, technical assistance, and evidence-based guidance needed by ... "
EHS Food Safety Topic | CDC,,, www.cdc.gov/nceh/ehs/Topics/FoodSafety.htm,"CDC’s Environmental Health Services Branch provides resources on preventing foodborne illnesses and outbreaks, protecting water, and improving …"
Environmental Health Videos | CDC-TV | CDC,,, www.cdc.gov/cdctv/environmentalhealth/index.html,Promote health & quality of life by preventing or controlling those diseases or disabilities resulting from interaction between people and the env …
CDC | National Center for Environmental Health | Training,,, www.cdc.gov/nceh/information/training.htm,"As part of the Centers for Disease Control and Prevention (CDC), the National Center for Environmental Health (NCEH) offers a number of training and ... "
Environmental Health | Features | CDC,,, www.cdc.gov/Features/EnvironmentalHealth.html,Environmental Health. Language: English. Español (Spanish) Recommend on Facebook Tweet Share Compartir. Current Feature. 2017; 2016; 2015; Features ... 
Environmental Health Services Program Home | EHS | CDC,,, www.cdc.gov/nceh/ehs/,"CDC’s Environmental Health Services Branch provides resources on preventing foodborne illnesses and outbreaks, keeping water safe, and improving the …"
CDC - CDC Summer Graduate Environmental Health Internship …,,, www.cdc.gov/nceh/geh/overview.htm,"Environmental health is the discipline that focuses on the interrelationships between people and their environment, promotes human health and …"
Articles in the Journal of Environmental Health | EHS | CDC,,, www.cdc.gov/nceh/ehs/publications/jeh_ehsb_columns.htm,"CDC’s Environmental Health Services Branch provides resources on preventing foodborne illnesses and outbreaks, keeping water safe, and improving the …"
EPA Environmental Health Services Community ... - cdc.gov,,, www.cdc.gov/nceh/ehs/CEHA/,"CDC’s Environmental Health Services Branch provides resources on preventing foodborne illnesses and outbreaks, protecting water, and improving …"
From Ophthalmology to Environmental Public Health – a Life …,,, blogs.cdc.gov/yourhealthyourenvironment/2017/01/30/from-ophthalmology-to-environmental-public-hea,CDC - Blogs - Your Health – Your Environment Blog – From Ophthalmology to Environmental Public Health – a Life Well TraveledYour Health … 
CDC | National Center for Environmental Health | About NCEH,,, www.cdc.gov/nceh/information/about.htm,"Overview. Your Environment: Your Health [PDF - 7.13 MB] The environment is everything around us - the air we breathe, the water we drink and use, and ... "
VCEHP-Vector Control for EH Professionals | EHS | CDC,,, www.cdc.gov/nceh/ehs/elearn/vcehp.html,"Environmental health professionals are on the frontline of helping individuals, institutions, and communities reduce threats from mosquitoes, ticks, …"
CDC - NCEH - Healthy Housing Reference Manual - Home Page,,, www.cdc.gov/nceh/publications/books/housing/housing.htm,"National Center for Environmental Health U.S. Department of Housing and Urban Development Original Printing 1976, Reprinted 1988, Updated and Revised …"
