 Troll Basketball Player - Outfit - World of Warcraft,Head. Legion Crown; Metallic Headband of Simm'onz; Elegant Circlet; Merciless Crown; Mercurial Circlet; Radiant Circlet …, www.wowhead.com/outfit=33903/troll-basketball-player
UC Irvine vs Kansas Live Basketball - Profiler - World of Warcraft,UC Irvine vs Kansas Live Basketball. By gjgjghjdsf (n/a) ago (Patch ?????) Custom. 90. 90. 90. 90. 90. 90. 90. 90. 90. 90. Spells. Spells. New tab. New tab., www.wowhead.com/list.../uc-irvine-vs-kansas-live-basketball
I was called a racist... - Off-Topic - Wowhead Forums,"Dec 17, 2010 ... when i say most black people are naturally good at basketball, i was called a racist.. when i say they are naturally stronger physically than other …", www.wowhead.com/forums&topic=177312/i-was-called-a-racist
Just some funny thoughts - WoW General - Wowhead Forums,"Apr 4, 2011 ... Just a few funny thoughts: A. Gnomes versing orcs in a game of football( American style). B. Gnomes versing trolls in basketball. C. A gnome …", www.wowhead.com/forums&topic.../just-some-funny-thoughts
A Martial Arts thread - Off-Topic - Wowhead Forums,"Apr 22, 2010 ... Might also be worth mentioning I was an acomplished basketball player but my parents were too poor to let me join the high school team.", www.wowhead.com/forums&topic=153561
My team:panathinaikos just won the european cup in basket - Off …,"May 3, 2009 ... I am very very happy.One thing we Greeks can now brag about is that we play very good basketball:)", www.wowhead.com/forums&topic=93793
End of Expansion - WoW General - Wowhead Forums,"Oct 1, 2010 ... If in a weeks time you only played basketball for 3 hours. Then you should only gain 3 hours worth of experience in basketball, not receive a …", www.wowhead.com/forums&topic=169509.8
Finally done with hunters - Hunter - Wowhead Forums,"Jul 1, 2009 ... how is playing basketball a risk? He might break his mouse finger and no longer be able to play Counterstrike, or whatever game it is …", www.wowhead.com/forums&topic=105382.3
Drop by and say hi! (Recycle Bin) - Off-Topic - Wowhead Forums,Dat irony Link f…, www.wowhead.com/forums.../drop-by-and-say-hi-recycle-bin
Drop by and say hi! (Recycle Bin) - Off-Topic - Wowhead Forums,"Jul 23, 2009 ... Which court are yall playing basketball? ... Which court are yall playing basketball ? Last edited by. Haters trying to block us but that cant stop us.", www.wowhead.com/forums.../drop-by-and-say-hi-recycle-bin
