,"The INL Beat, January/February 2017 - state.gov",, www.state.gov/j/inl/rls/nwsltr/2017/266373.htm,"... two governments, and one professional society to host a major international effort to strengthen drug demand reduction, which is a critical piece ...",
[PDF],, PAPUA NEW GUINEA 2015 INTERNATIONAL RELIGIOUS FREEDOM REPORT, www.state.gov/documents/organization/256345.pdf,Professionals Society referred the speaker to the Ombudsman Commission in October for misuse of office related to the plans. Limited d iscussions ... ,
,Jobs for Security Professionals,, www.state.gov/m/fsi/tc/79975.htm,RESOURCES. American Society for Industrial Security (ASIS) - www.asisonline.org • International organization for professionals responsible for ... ,
,,Office Management & Administrative Support, www.state.gov/m/fsi/tc/79970.htm,"• Professional association providing resources and services through education, networking and other member benefits. • Free job board. BOOKS. Burge, ...",
[PDF], security sector reform 7 - state.gov,, www.state.gov/documents/organization/115810.pdf,"In addition to building professional security forces, SSR programs support the: ... civil society actors articulate the public demand for safety and ... ",
, Professional Fellows Program Empowering Young ... - state.gov ,, www.state.gov/r/pa/prs/ps/2016/11/264348.htm,The U.S. Department of State convenes its largest-ever group of Professional Fellows ... relationship between civil society and government in the ... ,
,,Fellowships & Internships, www.state.gov/e/stas/fi/,Professional Science & Engineering Society Fellowship Program. The Professional Science and Engineering (S&E) Society Fellows Program enlists ... ,
,,Directory of Recruiting Organizations, www.state.gov/m/a/os/c32321.htm,,"The Office of Website Management, Bureau of Public Affairs, manages this site as a portal for information from the U.S. State Department. External ... "
,,Welcome Remarks for the Inaugural Meeting of the ..., www.state.gov/j/inl/rls/rm/2015/244622.htm,Welcome Remarks for the Inaugural Meeting of the International Society of Substance Use Prevention and Treatment Professionals,
[PDF], Resources for Medical Professionals - state.gov,, www.state.gov/documents/organization/252754.pdf,Resources for Medical Professionals Intro ... on this field can be found at the International Society for Telemedicine and eHealth site. ,
,Russel C. Jones - state.gov,, www.state.gov/p/io/unesco/members/48888.htm?first=russel&last=jones,"Prior to forming World Expertise L.L.C. as Managing Partner, he served as Executive Director of the National Society of Professional Engineers, ... ",
[PDF], Picture Perfect - state.gov,, www.state.gov/documents/organization/191230.pdf,"Professionals Society. For further information, contact David King in the Office of Civil Rights at (202) 647-9295 or kingdj@state.gov. 4 | STATE ... ",
[PDF],, Career Guide The Resume - State, www.state.gov/documents/organization/234524.pdf,"included, professional trainings and certifications, consulting, research or relevant publica-tions, travel or computer skills. Writing the Resume: ... ",
,Country Reports on Human Rights Practices - state.gov,, www.state.gov/j/drl/rls/hrrpt/2011/nea/186446.htm,... defined by the Consultative Council as professional associations and private ... Only one organization applied to form a professional society ... ,
[PDF],, INL Guide to Gender in the Criminal Justice System - State, www.state.gov/documents/organization/222034.pdf,"1 Increasing Access to Professional Opportunities for Women in the Criminal Justice System 11 2 ... more representative of society, promotes the rule ... ",
,2010 Human Rights Report: Burma - state.gov,, www.state.gov/j/drl/rls/hrrpt/2010/eap/154380.htm,"There were no medical doctors or trained health-care professionals on staff at several prisons. ... a professional society for businesswomen, ... ",
,AGOA and Professional Exchange - state.gov,, www.state.gov/p/af/rt/awep/profexch/index.htm,"The AWEP event enhances the program’s visibility among investors, members of civil society, U.S. policymakers, and African ministers. AWEP Professiona ... ",
[PDF],, EDUCATIONAL AND CULTURAL EXCHANGE PROGRAMS, www.state.gov/documents/organization/123606.pdf,In supporting educational and professional exchange programs that promote mutual understanding between the ... foster civil society and strengthen ... ,
[PDF],, Mission Statement - U.S. Department of State, www.state.gov/documents/organization/176174.pdf,"diplomats and other professionals to advance U.S ... It allows them the freedom to concentrate on their contributions to society, both personal and pr ... ",
,,15 Ways You Can Help Fight Human Trafficking, www.state.gov/j/tip/id/help/index.htm,,Anyone can join in the fight against human trafficking. Here are just a few ideas to consider. Learn the indicators of human trafficking so you can ... 
