 HBO Go now supports Apple’s TV app and single sign-on feature, by, Nick Statt," Jan 26, 2017,  7:04pm EST", , ,11 comments
 Trump’s immigration ban stranded a scientist with no job and no home, by, Rachel Becker," Jan 29, 2017,  9:50am EST", , ,74 comments
 Google Home Top 10 Most Wanted Features, by, Milan07," Jan 31, 2017,  4:43pm EST", , ,5 comments
" Bowser is a bad guy, but a very good dad", by, Megan Farokhmanesh," Jan 13, 2017, 12:07pm EST", , ,13 comments
 This iPhone 8 concept video imagines a touchscreen in the home button, by, Paul Miller," Feb  2, 2017,  2:02pm EST", , ,30 comments
 Hyperloop One wants to help your self-driving car go the speed of sound, by, Andrew J . Hawkins," Jan 23, 2017,  3:22pm EST", , ,2 comments
 Google Home now works with Belkin WeMo and Honeywell smart devices, by, James Vincent," Jan 24, 2017, 12:00pm EST", , ,7 comments
 LG Hub home robot, by, Ben Popper," Jan  4, 2017,  1:31pm EST",5, images, 
 Vivint’s Sky is an effort to turn the remote-control home into an actual smart home, by, Dan Seifert," Jan  4, 2017,  8:00am EST", , ,9 comments
 You can now control Vizio SmartCast devices through Google Home, by, Chaim Gartenberg," Jan 18, 2017, 10:23am EST", , ,16 comments
