"Fun DIY Kids Crafts (Unicorn Poop, Bouncy Ball, Bubbles)",Rachel Talbott,4 months ago,"436,722 views",,,,,I love testing out fun Pinterest ideas for Oliver on my free days. He always watches in amazement and asks lots of questions.,,,,,,,,,7:33
5 Super Cool Crafts To Do When Bored At Home | DIY Crafts For Kids by HooplaKidz How To,HooplaKidz How To - DIY Crafts & Play Doh Videos,1 year ago,"2,057,641 views",,,,,For more fun videos click here: ...,,,,,,,,,12:21
DIY SLIME RECIPE | KIDS CRAFTS | HOW TO | ATTIC AN,Attic Anatomy,1 year ago,"6,415,522 views",,,,,Skip to time : 4:21 for straight forward instructions :) have fun. NO BORAX RECIPE HERE : https://youtu.be/Q3YibsA1E-Q ...,,,,,,CC,,,5:58
"Mister Maker - Series 1, Episode 17",ZeeKay Junior,6 years ago,"5,622,026 views",Season 1,Episode 17,Mister Maker,,Check out the official ZeeKay Junior Facebook page: http://bit.ly/1UjB6qM Mister Maker is the ultimate interactive arts and crafts ..,,,,,,,,,19:31
"SimpleKidsCrafts - DIY, Miniatures,Doll Stuff, Crafts and More",,,,,,,"1,001 videos","Simple Kids Crafts is a 5 minutes crafts or less DIY video blog in which we share Dollhouse and Miniature Crafts, General DIY, ...",,,,,,Channel,Subscribe,"239,717",
Hands On Crafts for Kids Show Episode 1605-3,Plaid Crafts,3 years ago,"573,461 views",,,,,Learn about Chevron Patterns and Doodles in your art journal in another episode of Hands on Crafts for Kids with Candie Cooper!,,,,,,,,,4:31
DIY Project Ideas : How to Make a Mini Origami Book | Kids Crafts Simple Origami,StylEnrich,11 months ago,"1,110,389 views",,,,,"Hey Friends, Love My Craft Ideas? Please Subscribe to my Channel for upcoming innovative videos here ...",,,,,,,,,4:22
Kids Crafts : Kid craft ideas!,BunnieClaire,,,,,,,,DIY nightlight for kids! Star shaped paper lanterns! CUTE!! Luminary K,4:46,How to make Soap with a TOY in it ? DIY Soap TOYS,5:52,View full playlist (78 videos),,,,
How to Make Edible Play-Dough Ice Cream | Easy Kids Crafts,FUNwithKARINA,9 months ago,"70,617 views",,,,,Learn how to make super cute and delicious edible play dough ice cream. Thanks for watching! My other channel: ..,,,,,,,,,4:24
How to Make a Homemade Lava Lamp | Making DIY Kids Crafts with DCTC,DCTC Toy Channel,4 months ago,"73,400 views",,,,,"Making a bubbly, homemade lava lamp. Our official pages! https://twitter.com/dctcfans ...",,,,,,,,,3:23
2 Fall Kids' Crafts with Special Guest Lulu! - HGTV Handmade,HGTV Handmade,1 year ago,"71,758 views",,,,,Learn how to make these super cute bead keychains and popsicle stick bracelets with our favorite special guest Lulu! Follow us ...,,,,,,,,,11:43
Kids Craft kits Recorded Live #creativation 2017 Haan Crafts,Melody Lane,1 hour ago,175 views,,,,,"Haan Crafts, Kids Crafts, Recorded Live on Facebook Get my digital paper MelodyLanedesigns.com Buy the Cricut Explore Air ...",,,,,,New,,,3:13
Aquarium - Kids Crafts,Make Kids Crafts,1 year ago,"7,869 views",,,,,Subscribe: https://goo.gl/dF3xAH Aquarium ? http://makekidscrafts.com ? https://www.facebook.com/makekidscrafts.,,,,,,,,,5:17
Aquarium - Kids Crafts,Make Kids Crafts,1 year ago,"150,322 views",,,,,Subscribe: https://goo.gl/dF3xAH Aquarium - Kids Crafts ? http://makekidscrafts.com ? https://www.facebook.com/makekidscrafts.,,,,,,,,,9:03
Kids Cooking and Crafts,,,,,,,165 videos,"Fun kid friendly videos about cooking and crafts presented by your favorite superheroes and princess. Join Spiderman, Elsa and ...",,,,,,Channel,Subscribe,"96,648",
Fun Activities for Kids : How to Make a Paper Boat | Kids Crafts,StylEnrich,11 months ago,"23,671 views",,,,,Hey crafters ! Looking for a fresh take on art and craft? So Plz Subscribe to my Channel here - https://www.youtube.com/stylenrich ..,,,,,,,,,2:29
DIY | JELLY FISH | Kid Fun Crafts,MORENA DIY,7 months ago,"13,501 views",,,,,"In this video tutorial I show you how to make DIY jellyfish in a bottle is a fun, quick and easy craft project to try. All the materials can ...",,,,,,,,,1:49
Crafts Ideas for Kids : Learn Owl Crafts for Kids | Preschool Fun crafts | Kids Project Ideas,StylEnrich,11 months ago,"58,525 views",,,,,"Hey Friends, Want to see more interesting KIDS CRAFTS IDEAS videos? Please SUBSCRIBE to my Channel ...",,,,,,,,,3:56
How to build a Match stick ship | Match stick crafts | Kids Crafts using Match Sticks,Gup Gup TV,1 month ago,539 views,,,,,Watch this video to build a ship using Match sticks.,,,,,,,,,5:44
Batman Egg Craft & More Kids Crafts - Crafty Carol Compilation,Cool School,2 years ago,"2,633,442 views",,,,,"Also watch our Disney Egg Craft where we do Mickey Mouse, Maleficent, and Princess Aurora eggs - http://bit.ly/DisneyEggCraft ...",,,,,,,,,15:55
