 Ad, Shopkins Inspired Birthday Iron On Transfer, ImaginationIronOns, CA$,3.9
 Ad," Custom Heat Pressed Girls Short Sleeved Ruffle Shirt with *Any Design in Our Shop*, mailed", BonTempsTees, CA$,22.2
 Ad, Disney Tinkerbell Blue or Purple or Green Single Outlet Plate Cover with Child Safety Plugs Switch Covers to match in shop, QuillowShop, CA$,6.73
 Ad, BB-8 Knit Cap for BJD, ADollShopToo, CA$,8.07
 ," Official Disney Shopping- Snow White Dress, size 4/5 XS", SALEvageCOM, CA$,20.19
 ," Erin Condren Life Planner, Happy Planner Sizes, Recollections Planner Cover Set: Cinderella, shoes, fashion, disney, shopping, glitter, blue", BlissPaperPrints, CA$,16.15
 ," Downtown Disney Paper Piecing Title, Disney World, Disney Springs Disney Vacation", CountryCroppers, CA$,4.02
 , Cute as a Button - Handmade Wooden Heart Earrings, JollyHollieday, CA$,6.73
 , Girls Disney shorts reversible shorts with yellow bias tape trim Red Polka dots Black Polka dots 2 pairs in 1 Purple PRincess Shop, MyPurplePrincessShop, CA$,44.41
 ," Belle Print, Beauty and the Beast, Watercolor Art, Type 3, Disney Poster, Room Art, Kids Art, Print Shop, Art Prints, Valentines Day Gift", InkistPrints, CA$,13.39
 ," Candy Shop - Digital Scrapbooking kit for birthdays, fair, carnival, festivals, candy, disney INSTANT DOWNLOAD", sahlink, CA$,10.75
 , Walt Disney Santa's Toy Shop Vintage 1950 Christmas Little Golden Book, misserendipity, CA$,8.06
 , DISNEY's  Mickey Mouse Ho Ho Ho XMas Fabric -- 20-70% off SALE throughout our Shop, Altcollect, CA$,10.16
 , 5% Discount 28 X Snowflake Wall Stickers Christmas wall Decals Disney Frozen themed Room Shop Wondow Decor, JRDecal, CA$,14.38
 , Enesco Minnie's Mall Haul Disney Ornament Minnie Mouse Driving Car Shopping Treasury of Christmas Mickey & Co Vintage Collection, CrowningCollections, CA$,44.4
 , Mickey Snowflake Tote Bag Custom Name Winter Merry Christmas Happy Holidays Disney World Gift Present Disneyland Vacation Shopping Colors, MinniesChicBoutique, CA$,26.85
 , Vintage Santas Toy Shop A Little Golden Book Childrens Book Disney Mid Century Christmas Holiday Gift, AntiqueDiscoveries, CA$,6.72
 , Vintage Little Golden Books Christmas Themed 1960's Walt Disney's Santa's Toy Shop & Christmas Carols, HolySerendipity, CA$,10
 , Littlest Pet Shop / Travel  or Child Pillow Case  / Standard Pillow Case / Disney, Blessedbyarose, CA$,14.13
 , Walt Disney’s Santa’s Toy Shop – Vintage Children’s Little Golden Book – 451-17, fromThePeddlersCart, CA$,5.38
 ," Shopping Cart Seat Cover, Disney's Planes", NeatSeatCoversNMore, CA$,47.1
 , Frozen Character Panel licensed fabric  Fat Quarters 100% cotton quilting dressmaking crafting elsa and anna disney princess panel  UK Shop, PSfabricshop, CA$,20.21
 , Sawyer Mickey Mouse View-Master Slides • Reels• Walt Disney • B 528 • Pretend Play • Childs Toy • Pluto • Toy Shop, Glendasuniquevintage, CA$,10.77
 , Wall-E and Eva hand painted tote bag. Disney Pixar fan art. Robot cute friendship love. Large eco friendly shopping cotton canvas cream bag., ClaudesWonders, CA$,33.64
 , Shopping at Disney Springs: Add-on Page for Child's Walt Disney World Journals, CosmosMariners, CA$,1.35
 , Shopkins - shop kins - cookie - fabric- disney fabric - shopping - candy - shop kins fabric- material -sewing -supply -, fabricmason, CA$,11.44
 , On sale! Vintage Children's Book   - Walt Disney's Santa's Toy Shop 1950, TwoCatsVintage, CA$,8.07
 , Disney Minnie Mouse Loves To Shop By Springs Creative Fleece Printed Fabric - Sold By The Yard (FH21) Polka Dot Blanket Warm, BigZFabric, CA$,17.48
 Ad," Belle Print, Beauty and the Beast, Watercolor Art, Type 3, Disney Poster, Room Art, Kids Art, Print Shop, Art Prints, Valentines Day Gift", InkistPrints, CA$,13.39
 Ad," 10 Assorted Animal Print Mini Envelopes: Thank you note envelopes, shop packaging, thank yous, small miniature envelopes", SKWOriginalsbySummer, CA$,4.37
 Ad," Canvas Tote Bag, Have Courage Be Kind Inspirational Canvas Tote Bag, Printed Tote Bag, Market Bag, Shopping Bag, Reusable Grocery Bag 0106", HeartAndWillowPrints, CA$,33.58
 Ad, 5' Christmas Disney Hair Bow Clip - Hair Accessorie - Handmade - Craft Supplies - DIY - Fld Over Elastic, RubisCraftShop, CA$,8.01
 , Girls Disney Inspired Mini Mouse 3 Piece Outfit Theatrical Costume Dance Parties Cosplay Cindys Corner Shop, Cindyscornershop, CA$,53.82
 , Santa's Toy Shop Vintage Walt Disney Little Golden Book Adapted by Al Dempster 1st Edition A 1950 NoD16, VickiesVintageBooks, CA$,45.75
 , Disney Minnie Flat Bed Sheet Colorful Shopping Fabric, LaudersHouse, CA$,42
 , Little Golden Book - Santa's Toy Shop. Walt Disney hardback. 1950 publication. LGB. Rare and Collectible. Great gift!  451-10, VintageBookworms, CA$,12.1
 , Shopping bag Disney model, Miciatoby, CA$,14.34
 , Shopping Cart High Chair Cover Pink and Blue Disney Princess  Free Boo Boo Hot/Cold pack with purchase, ATouchofStitchery, CA$,60.56
 , Disneys Forgotten Princess - canvas tote shopping bag - shoulder bag - beach tote - canvas tote bag -  Market Bag, BridgeEndPrint, CA$,13.46
 ," Disney World Vacation Souvenir Gift Shopping List | Gifts, Souvenirs, Merchandise Shopping & Budget Sheets | INSTANT DOWNLOAD", MyDisneyThings, CA$,2.69
 ," Vtg Little Golden Book Santa's Toy Shop 1950 T Print Walt Disney Production Visit to Santa's Toy Shop to See Elves Working, Mrs Santa MORE", GlassCircusAntiques, CA$,3.57
 ," Vintage Santa's Toy Shop, Walt Disney Little Golden Book Adapted by Al Dempster, N Edition, 1950s NoD16", VintagePrairieHome, CA$,14.67
 , Santa's Toy Shop Vintage Walt Disney Children's Book, VintageByJade, CA$,5.37
 , 1978 Walt Disney's Santa's Toy Shop Children's Story A Little Golden Books, 2BarnPickers, CA$,13.46
 , Walt Disney's Santa's Toy Shop 1950, UNSC2, CA$,8.75
 , Disney mermaid Tote bag- Fun Quote bag- Unique tote bag- Shopping tote- printed tote bag. Inspirational tote bag- Personalized bag-Quote bag, JustBeBohoCollective, CA$,16.84
 ," Shopkins, Shop Kins, Lipstick Charm, Split Ring Rhinestone Pendant Necklace, Disney inspired Chunky Necklace Pendant", HoneyBeeChicBoutique, CA$,5.37
 , Disney Princess Childrens Cotton Shopping bag / Book bag, PandoraJaynesGiftBox, CA$,13.46
 ," Santas Toy Shop Walt Disney reprinted Little Golden Book santa elves toys story children book, children reading SANTAS TOY SHOP illustration", vintagebooklover, CA$,4.04
 , Disney Villains #1 Shopping or Record Bag, outofstep, CA$,20.19
 , Moana Embroidery design Maui Applique Machine embroidery design - Disney - NushNusha shop, NushNusha, CA$,4.04
 , Disney Minnie Mouse Shopping PANEL Fabric - Length 90 x Width 65 inches with Pillow Panel L24 x W65 Inches, SewingUniverse, CA$,28.63
 , 3 Vintage Christmas Books Bundle for kids Childrens Xmas book gift Stocking Stuffer Holiday Stories Santa Claus Toy Shop Mickey Mouse Disney, MyTreasureDrawer, CA$,17.49
 ," tote bag your mother bambi, disney, flowers, canvas, tote bag, handbag, cotton, shopping bag, bag canvas, illustration, black, natural", BySardiine, CA$,21.51
 ," A Little Golden Book Walt Disney's Santa's Toy Shop  Vintage LGB,  Vintage Children's Book,  A Golden Book Christmas Story", CannadyCreations, CA$,5.37
 ," Minnie Mouse Goes Shopping, Red Disney Dress with Black White Dotted Band, (infant, baby, girl, toddler,child) with matching hair accessory.", SewSusanCreations, CA$,36.33
